03:33:53.284373 eth0  M   IP ospf_r1_1.ospf_n4 > 224.0.0.5: OSPFv2, Hello, length 52
03:33:53.548138 eth0  Out IP 744c7fe727fa > 224.0.0.5: OSPFv2, Hello, length 52
03:33:53.823658 eth0  M   IP ospf_r3_1.ospf_n4 > 224.0.0.5: OSPFv2, Hello, length 52
03:34:03.284368 eth0  M   IP ospf_r1_1.ospf_n4 > 224.0.0.5: OSPFv2, Hello, length 52
03:34:03.548167 eth0  Out IP 744c7fe727fa > 224.0.0.5: OSPFv2, Hello, length 52
03:34:03.823710 eth0  M   IP ospf_r3_1.ospf_n4 > 224.0.0.5: OSPFv2, Hello, length 52
03:34:13.284370 eth0  M   IP ospf_r1_1.ospf_n4 > 224.0.0.5: OSPFv2, Hello, length 52
03:34:13.548175 eth0  Out IP 744c7fe727fa > 224.0.0.5: OSPFv2, Hello, length 52
03:34:13.823699 eth0  M   IP ospf_r3_1.ospf_n4 > 224.0.0.5: OSPFv2, Hello, length 52
03:34:23.284378 eth0  M   IP ospf_r1_1.ospf_n4 > 224.0.0.5: OSPFv2, Hello, length 52
03:34:23.548193 eth0  Out IP 744c7fe727fa > 224.0.0.5: OSPFv2, Hello, length 52
03:34:23.823705 eth0  M   IP ospf_r3_1.ospf_n4 > 224.0.0.5: OSPFv2, Hello, length 52
03:34:33.284380 eth0  M   IP ospf_r1_1.ospf_n4 > 224.0.0.5: OSPFv2, Hello, length 52
03:34:33.548207 eth0  Out IP 744c7fe727fa > 224.0.0.5: OSPFv2, Hello, length 52
03:34:33.823730 eth0  M   IP ospf_r3_1.ospf_n4 > 224.0.0.5: OSPFv2, Hello, length 52
03:34:43.284465 eth0  M   IP ospf_r1_1.ospf_n4 > 224.0.0.5: OSPFv2, Hello, length 52
03:34:43.548224 eth0  Out IP 744c7fe727fa > 224.0.0.5: OSPFv2, Hello, length 52
03:34:43.823726 eth0  M   IP ospf_r3_1.ospf_n4 > 224.0.0.5: OSPFv2, Hello, length 52

