03:33:53.284393 eth1  M   IP ospf_r1_1.ospf_n4 > 224.0.0.5: OSPFv2, Hello, length 52
03:33:53.548213 eth1  M   IP ospf_r2_1.ospf_n4 > 224.0.0.5: OSPFv2, Hello, length 52
03:33:53.823488 eth0  Out IP ca6a91129e47 > 224.0.0.5: OSPFv2, Hello, length 48
03:33:53.823593 eth1  Out IP ca6a91129e47 > 224.0.0.5: OSPFv2, Hello, length 52
03:33:54.344435 eth0  M   IP ospf_r5_1.ospf_n3 > 224.0.0.5: OSPFv2, Hello, length 48
03:34:03.284388 eth1  M   IP ospf_r1_1.ospf_n4 > 224.0.0.5: OSPFv2, Hello, length 52
03:34:03.548230 eth1  M   IP ospf_r2_1.ospf_n4 > 224.0.0.5: OSPFv2, Hello, length 52
03:34:03.823522 eth0  Out IP ca6a91129e47 > 224.0.0.5: OSPFv2, Hello, length 48
03:34:03.823630 eth1  Out IP ca6a91129e47 > 224.0.0.5: OSPFv2, Hello, length 52
03:34:04.344456 eth0  M   IP ospf_r5_1.ospf_n3 > 224.0.0.5: OSPFv2, Hello, length 48
03:34:13.284392 eth1  M   IP ospf_r1_1.ospf_n4 > 224.0.0.5: OSPFv2, Hello, length 52
03:34:13.548232 eth1  M   IP ospf_r2_1.ospf_n4 > 224.0.0.5: OSPFv2, Hello, length 52
03:34:13.823555 eth0  Out IP ca6a91129e47 > 224.0.0.5: OSPFv2, Hello, length 48
03:34:13.823658 eth1  Out IP ca6a91129e47 > 224.0.0.5: OSPFv2, Hello, length 52
03:34:14.344465 eth0  M   IP ospf_r5_1.ospf_n3 > 224.0.0.5: OSPFv2, Hello, length 48
03:34:23.284400 eth1  M   IP ospf_r1_1.ospf_n4 > 224.0.0.5: OSPFv2, Hello, length 52
03:34:23.548254 eth1  M   IP ospf_r2_1.ospf_n4 > 224.0.0.5: OSPFv2, Hello, length 52
03:34:23.823572 eth0  Out IP ca6a91129e47 > 224.0.0.5: OSPFv2, Hello, length 48
03:34:23.823666 eth1  Out IP ca6a91129e47 > 224.0.0.5: OSPFv2, Hello, length 52
03:34:24.344470 eth0  M   IP ospf_r5_1.ospf_n3 > 224.0.0.5: OSPFv2, Hello, length 48
03:34:33.284399 eth1  M   IP ospf_r1_1.ospf_n4 > 224.0.0.5: OSPFv2, Hello, length 52
03:34:33.548262 eth1  M   IP ospf_r2_1.ospf_n4 > 224.0.0.5: OSPFv2, Hello, length 52
03:34:33.823593 eth0  Out IP ca6a91129e47 > 224.0.0.5: OSPFv2, Hello, length 48
03:34:33.823689 eth1  Out IP ca6a91129e47 > 224.0.0.5: OSPFv2, Hello, length 52
03:34:34.344472 eth0  M   IP ospf_r5_1.ospf_n3 > 224.0.0.5: OSPFv2, Hello, length 48
03:34:43.284490 eth1  M   IP ospf_r1_1.ospf_n4 > 224.0.0.5: OSPFv2, Hello, length 52
03:34:43.548302 eth1  M   IP ospf_r2_1.ospf_n4 > 224.0.0.5: OSPFv2, Hello, length 52
03:34:43.823602 eth0  Out IP ca6a91129e47 > 224.0.0.5: OSPFv2, Hello, length 48
03:34:43.823689 eth1  Out IP ca6a91129e47 > 224.0.0.5: OSPFv2, Hello, length 52
03:34:44.344524 eth0  M   IP ospf_r5_1.ospf_n3 > 224.0.0.5: OSPFv2, Hello, length 48

