03:33:53.228902 eth0  Out IP c38a3de88138 > 224.0.0.5: OSPFv2, Hello, length 48
03:33:53.228978 eth1  Out IP c38a3de88138 > 224.0.0.5: OSPFv2, Hello, length 48
03:33:53.284297 eth1  M   IP ospf_r1_1.ospf_n2 > 224.0.0.5: OSPFv2, Hello, length 48
03:33:54.092106 eth0  M   IP ospf_r4_1.ospf_n0 > 224.0.0.5: OSPFv2, Hello, length 48
03:34:03.228895 eth0  Out IP c38a3de88138 > 224.0.0.5: OSPFv2, Hello, length 48
03:34:03.228962 eth1  Out IP c38a3de88138 > 224.0.0.5: OSPFv2, Hello, length 48
03:34:03.284303 eth1  M   IP ospf_r1_1.ospf_n2 > 224.0.0.5: OSPFv2, Hello, length 48
03:34:04.092490 eth0  M   IP ospf_r4_1.ospf_n0 > 224.0.0.5: OSPFv2, Hello, length 48
03:34:13.228883 eth0  Out IP c38a3de88138 > 224.0.0.5: OSPFv2, Hello, length 48
03:34:13.228966 eth1  Out IP c38a3de88138 > 224.0.0.5: OSPFv2, Hello, length 48
03:34:13.284300 eth1  M   IP ospf_r1_1.ospf_n2 > 224.0.0.5: OSPFv2, Hello, length 48
03:34:14.092482 eth0  M   IP ospf_r4_1.ospf_n0 > 224.0.0.5: OSPFv2, Hello, length 48
03:34:23.228898 eth0  Out IP c38a3de88138 > 224.0.0.5: OSPFv2, Hello, length 48
03:34:23.228979 eth1  Out IP c38a3de88138 > 224.0.0.5: OSPFv2, Hello, length 48
03:34:23.284319 eth1  M   IP ospf_r1_1.ospf_n2 > 224.0.0.5: OSPFv2, Hello, length 48
03:34:24.093263 eth0  M   IP ospf_r4_1.ospf_n0 > 224.0.0.5: OSPFv2, Hello, length 48
03:34:33.228921 eth0  Out IP c38a3de88138 > 224.0.0.5: OSPFv2, Hello, length 48
03:34:33.229004 eth1  Out IP c38a3de88138 > 224.0.0.5: OSPFv2, Hello, length 48
03:34:33.284318 eth1  M   IP ospf_r1_1.ospf_n2 > 224.0.0.5: OSPFv2, Hello, length 48
03:34:34.093512 eth0  M   IP ospf_r4_1.ospf_n0 > 224.0.0.5: OSPFv2, Hello, length 48
03:34:43.228944 eth0  Out IP c38a3de88138 > 224.0.0.5: OSPFv2, Hello, length 48
03:34:43.229023 eth1  Out IP c38a3de88138 > 224.0.0.5: OSPFv2, Hello, length 48
03:34:43.284361 eth1  M   IP ospf_r1_1.ospf_n2 > 224.0.0.5: OSPFv2, Hello, length 48
03:34:44.093505 eth0  M   IP ospf_r4_1.ospf_n0 > 224.0.0.5: OSPFv2, Hello, length 48

