03:33:53.228939 eth0  M   IP ospf_r0_1.ospf_n0 > 224.0.0.5: OSPFv2, Hello, length 48
03:33:54.092082 eth0  Out IP b0f31a59857d > 224.0.0.5: OSPFv2, Hello, length 48
03:33:54.092144 eth1  Out IP b0f31a59857d > 224.0.0.5: OSPFv2, Hello, length 48
03:33:54.344365 eth1  M   IP ospf_r5_1.ospf_n1 > 224.0.0.5: OSPFv2, Hello, length 48
03:34:03.228921 eth0  M   IP ospf_r0_1.ospf_n0 > 224.0.0.5: OSPFv2, Hello, length 48
03:34:04.092467 eth0  Out IP b0f31a59857d > 224.0.0.5: OSPFv2, Hello, length 48
03:34:04.092524 eth1  Out IP b0f31a59857d > 224.0.0.5: OSPFv2, Hello, length 48
03:34:04.344379 eth1  M   IP ospf_r5_1.ospf_n1 > 224.0.0.5: OSPFv2, Hello, length 48
03:34:13.228908 eth0  M   IP ospf_r0_1.ospf_n0 > 224.0.0.5: OSPFv2, Hello, length 48
03:34:14.092459 eth0  Out IP b0f31a59857d > 224.0.0.5: OSPFv2, Hello, length 48
03:34:14.092530 eth1  Out IP b0f31a59857d > 224.0.0.5: OSPFv2, Hello, length 48
03:34:14.344394 eth1  M   IP ospf_r5_1.ospf_n1 > 224.0.0.5: OSPFv2, Hello, length 48
03:34:23.228924 eth0  M   IP ospf_r0_1.ospf_n0 > 224.0.0.5: OSPFv2, Hello, length 48
03:34:24.093239 eth0  Out IP b0f31a59857d > 224.0.0.5: OSPFv2, Hello, length 48
03:34:24.093304 eth1  Out IP b0f31a59857d > 224.0.0.5: OSPFv2, Hello, length 48
03:34:24.344396 eth1  M   IP ospf_r5_1.ospf_n1 > 224.0.0.5: OSPFv2, Hello, length 48
03:34:33.228946 eth0  M   IP ospf_r0_1.ospf_n0 > 224.0.0.5: OSPFv2, Hello, length 48
03:34:34.093488 eth0  Out IP b0f31a59857d > 224.0.0.5: OSPFv2, Hello, length 48
03:34:34.093552 eth1  Out IP b0f31a59857d > 224.0.0.5: OSPFv2, Hello, length 48
03:34:34.344410 eth1  M   IP ospf_r5_1.ospf_n1 > 224.0.0.5: OSPFv2, Hello, length 48
03:34:43.228971 eth0  M   IP ospf_r0_1.ospf_n0 > 224.0.0.5: OSPFv2, Hello, length 48
03:34:44.093479 eth0  Out IP b0f31a59857d > 224.0.0.5: OSPFv2, Hello, length 48
03:34:44.093560 eth1  Out IP b0f31a59857d > 224.0.0.5: OSPFv2, Hello, length 48
03:34:44.344451 eth1  M   IP ospf_r5_1.ospf_n1 > 224.0.0.5: OSPFv2, Hello, length 48

