14:38:50.802147 eth0  Out IP 2abadf275fbe > 224.0.0.10: EIGRP Hello, length: 40
14:38:50.802231 eth1  Out IP 2abadf275fbe > 224.0.0.10: EIGRP Hello, length: 40
14:38:51.315595 eth0  M   IP eigrp_r5_1.eigrp_n3 > 224.0.0.10: EIGRP Hello, length: 40
14:38:55.285113 eth1  M   IP eigrp_r1_1.eigrp_n4 > 224.0.0.10: EIGRP Hello, length: 40
14:38:55.537639 eth1  M   IP eigrp_r2_1.eigrp_n4 > 224.0.0.10: EIGRP Hello, length: 40
14:38:55.802177 eth0  Out IP 2abadf275fbe > 224.0.0.10: EIGRP Hello, length: 40
14:38:55.802239 eth1  Out IP 2abadf275fbe > 224.0.0.10: EIGRP Hello, length: 40
14:38:56.315573 eth0  M   IP eigrp_r5_1.eigrp_n3 > 224.0.0.10: EIGRP Hello, length: 40
14:39:00.285142 eth1  M   IP eigrp_r1_1.eigrp_n4 > 224.0.0.10: EIGRP Hello, length: 40
14:39:00.537640 eth1  M   IP eigrp_r2_1.eigrp_n4 > 224.0.0.10: EIGRP Hello, length: 40
14:39:00.802194 eth0  Out IP 2abadf275fbe > 224.0.0.10: EIGRP Hello, length: 40
14:39:00.802265 eth1  Out IP 2abadf275fbe > 224.0.0.10: EIGRP Hello, length: 40
14:39:01.315604 eth0  M   IP eigrp_r5_1.eigrp_n3 > 224.0.0.10: EIGRP Hello, length: 40
14:39:05.285162 eth1  M   IP eigrp_r1_1.eigrp_n4 > 224.0.0.10: EIGRP Hello, length: 40
14:39:05.537664 eth1  M   IP eigrp_r2_1.eigrp_n4 > 224.0.0.10: EIGRP Hello, length: 40
14:39:05.802212 eth0  Out IP 2abadf275fbe > 224.0.0.10: EIGRP Hello, length: 40
14:39:05.802325 eth1  Out IP 2abadf275fbe > 224.0.0.10: EIGRP Hello, length: 40
14:39:06.315904 eth0  M   IP eigrp_r5_1.eigrp_n3 > 224.0.0.10: EIGRP Hello, length: 40
14:39:10.285187 eth1  M   IP eigrp_r1_1.eigrp_n4 > 224.0.0.10: EIGRP Hello, length: 40
14:39:10.537699 eth1  M   IP eigrp_r2_1.eigrp_n4 > 224.0.0.10: EIGRP Hello, length: 40
14:39:10.802248 eth0  Out IP 2abadf275fbe > 224.0.0.10: EIGRP Hello, length: 40
14:39:10.802325 eth1  Out IP 2abadf275fbe > 224.0.0.10: EIGRP Hello, length: 40
14:39:11.315886 eth0  M   IP eigrp_r5_1.eigrp_n3 > 224.0.0.10: EIGRP Hello, length: 40
14:39:15.285179 eth1  M   IP eigrp_r1_1.eigrp_n4 > 224.0.0.10: EIGRP Hello, length: 40
14:39:15.537706 eth1  M   IP eigrp_r2_1.eigrp_n4 > 224.0.0.10: EIGRP Hello, length: 40
14:39:15.802239 eth0  Out IP 2abadf275fbe > 224.0.0.10: EIGRP Hello, length: 40
14:39:15.802302 eth1  Out IP 2abadf275fbe > 224.0.0.10: EIGRP Hello, length: 40
14:39:16.316060 eth0  M   IP eigrp_r5_1.eigrp_n3 > 224.0.0.10: EIGRP Hello, length: 40
14:39:20.285195 eth1  M   IP eigrp_r1_1.eigrp_n4 > 224.0.0.10: EIGRP Hello, length: 40
14:39:20.537718 eth1  M   IP eigrp_r2_1.eigrp_n4 > 224.0.0.10: EIGRP Hello, length: 40
14:39:20.802260 eth0  Out IP 2abadf275fbe > 224.0.0.10: EIGRP Hello, length: 40
14:39:20.802333 eth1  Out IP 2abadf275fbe > 224.0.0.10: EIGRP Hello, length: 40
14:39:21.316049 eth0  M   IP eigrp_r5_1.eigrp_n3 > 224.0.0.10: EIGRP Hello, length: 40
14:39:25.285199 eth1  M   IP eigrp_r1_1.eigrp_n4 > 224.0.0.10: EIGRP Hello, length: 40
14:39:25.537779 eth1  M   IP eigrp_r2_1.eigrp_n4 > 224.0.0.10: EIGRP Hello, length: 40
14:39:25.802277 eth0  Out IP 2abadf275fbe > 224.0.0.10: EIGRP Hello, length: 40
14:39:25.802351 eth1  Out IP 2abadf275fbe > 224.0.0.10: EIGRP Hello, length: 40
14:39:26.316065 eth0  M   IP eigrp_r5_1.eigrp_n3 > 224.0.0.10: EIGRP Hello, length: 40
14:39:30.285313 eth1  M   IP eigrp_r1_1.eigrp_n4 > 224.0.0.10: EIGRP Hello, length: 40
14:39:30.537802 eth1  M   IP eigrp_r2_1.eigrp_n4 > 224.0.0.10: EIGRP Hello, length: 40
14:39:30.802293 eth0  Out IP 2abadf275fbe > 224.0.0.10: EIGRP Hello, length: 40
14:39:30.802366 eth1  Out IP 2abadf275fbe > 224.0.0.10: EIGRP Hello, length: 40
14:39:31.316098 eth0  M   IP eigrp_r5_1.eigrp_n3 > 224.0.0.10: EIGRP Hello, length: 40
14:39:35.285336 eth1  M   IP eigrp_r1_1.eigrp_n4 > 224.0.0.10: EIGRP Hello, length: 40
14:39:35.537802 eth1  M   IP eigrp_r2_1.eigrp_n4 > 224.0.0.10: EIGRP Hello, length: 40
14:39:35.802310 eth0  Out IP 2abadf275fbe > 224.0.0.10: EIGRP Hello, length: 40
14:39:35.802382 eth1  Out IP 2abadf275fbe > 224.0.0.10: EIGRP Hello, length: 40
14:39:36.316135 eth0  M   IP eigrp_r5_1.eigrp_n3 > 224.0.0.10: EIGRP Hello, length: 40
14:39:40.285297 eth1  M   IP eigrp_r1_1.eigrp_n4 > 224.0.0.10: EIGRP Hello, length: 40
14:39:40.537818 eth1  M   IP eigrp_r2_1.eigrp_n4 > 224.0.0.10: EIGRP Hello, length: 40
14:39:40.802321 eth0  Out IP 2abadf275fbe > 224.0.0.10: EIGRP Hello, length: 40
14:39:40.802403 eth1  Out IP 2abadf275fbe > 224.0.0.10: EIGRP Hello, length: 40
14:39:41.316156 eth0  M   IP eigrp_r5_1.eigrp_n3 > 224.0.0.10: EIGRP Hello, length: 40
14:39:45.285313 eth1  M   IP eigrp_r1_1.eigrp_n4 > 224.0.0.10: EIGRP Hello, length: 40
14:39:45.537836 eth1  M   IP eigrp_r2_1.eigrp_n4 > 224.0.0.10: EIGRP Hello, length: 40
14:39:45.802335 eth0  Out IP 2abadf275fbe > 224.0.0.10: EIGRP Hello, length: 40
14:39:45.802402 eth1  Out IP 2abadf275fbe > 224.0.0.10: EIGRP Hello, length: 40
14:39:46.316184 eth0  M   IP eigrp_r5_1.eigrp_n3 > 224.0.0.10: EIGRP Hello, length: 40

