03:33:53.229002 eth0  M   IP ospf_r0_1.ospf_n2 > 224.0.0.5: OSPFv2, Hello, length 48
03:33:53.284270 eth0  Out IP 7d7bd754319b > 224.0.0.5: OSPFv2, Hello, length 48
03:33:53.284341 eth1  Out IP 7d7bd754319b > 224.0.0.5: OSPFv2, Hello, length 52
03:33:53.548187 eth1  M   IP ospf_r2_1.ospf_n4 > 224.0.0.5: OSPFv2, Hello, length 52
03:33:53.823635 eth1  M   IP ospf_r3_1.ospf_n4 > 224.0.0.5: OSPFv2, Hello, length 52
03:34:03.228973 eth0  M   IP ospf_r0_1.ospf_n2 > 224.0.0.5: OSPFv2, Hello, length 48
03:34:03.284280 eth0  Out IP 7d7bd754319b > 224.0.0.5: OSPFv2, Hello, length 48
03:34:03.284353 eth1  Out IP 7d7bd754319b > 224.0.0.5: OSPFv2, Hello, length 52
03:34:03.548198 eth1  M   IP ospf_r2_1.ospf_n4 > 224.0.0.5: OSPFv2, Hello, length 52
03:34:03.823647 eth1  M   IP ospf_r3_1.ospf_n4 > 224.0.0.5: OSPFv2, Hello, length 52
03:34:13.228978 eth0  M   IP ospf_r0_1.ospf_n2 > 224.0.0.5: OSPFv2, Hello, length 48
03:34:13.284282 eth0  Out IP 7d7bd754319b > 224.0.0.5: OSPFv2, Hello, length 48
03:34:13.284356 eth1  Out IP 7d7bd754319b > 224.0.0.5: OSPFv2, Hello, length 52
03:34:13.548205 eth1  M   IP ospf_r2_1.ospf_n4 > 224.0.0.5: OSPFv2, Hello, length 52
03:34:13.823675 eth1  M   IP ospf_r3_1.ospf_n4 > 224.0.0.5: OSPFv2, Hello, length 52
03:34:23.228991 eth0  M   IP ospf_r0_1.ospf_n2 > 224.0.0.5: OSPFv2, Hello, length 48
03:34:23.284298 eth0  Out IP 7d7bd754319b > 224.0.0.5: OSPFv2, Hello, length 48
03:34:23.284364 eth1  Out IP 7d7bd754319b > 224.0.0.5: OSPFv2, Hello, length 52
03:34:23.548223 eth1  M   IP ospf_r2_1.ospf_n4 > 224.0.0.5: OSPFv2, Hello, length 52
03:34:23.823682 eth1  M   IP ospf_r3_1.ospf_n4 > 224.0.0.5: OSPFv2, Hello, length 52
03:34:33.229015 eth0  M   IP ospf_r0_1.ospf_n2 > 224.0.0.5: OSPFv2, Hello, length 48
03:34:33.284301 eth0  Out IP 7d7bd754319b > 224.0.0.5: OSPFv2, Hello, length 48
03:34:33.284367 eth1  Out IP 7d7bd754319b > 224.0.0.5: OSPFv2, Hello, length 52
03:34:33.548234 eth1  M   IP ospf_r2_1.ospf_n4 > 224.0.0.5: OSPFv2, Hello, length 52
03:34:33.823705 eth1  M   IP ospf_r3_1.ospf_n4 > 224.0.0.5: OSPFv2, Hello, length 52
03:34:43.229033 eth0  M   IP ospf_r0_1.ospf_n2 > 224.0.0.5: OSPFv2, Hello, length 48
03:34:43.284335 eth0  Out IP 7d7bd754319b > 224.0.0.5: OSPFv2, Hello, length 48
03:34:43.284425 eth1  Out IP 7d7bd754319b > 224.0.0.5: OSPFv2, Hello, length 52
03:34:43.548276 eth1  M   IP ospf_r2_1.ospf_n4 > 224.0.0.5: OSPFv2, Hello, length 52
03:34:43.823704 eth1  M   IP ospf_r3_1.ospf_n4 > 224.0.0.5: OSPFv2, Hello, length 52

